{
  "schema_version": 1,
  "number": 1,
  "title": "雾港的灯",
  "goal": "交代伊澄身世、父亲失踪、获得旧提灯",
  "characters": ["伊澄"],
  "body": "伊澄是在灯塔的守夜钟声里长大的。父亲失踪后的第七天，她第一次独自走上塔顶，把那只蒙尘的旧提灯抱了下来。\n\n雾从傍晚开始变浓，像一只苍白的手，缓缓攥住整座雾港。伊澄坐在窗边，指尖擦过提灯的铜锈。灯芯早已干涸，她却鬼使神差地划亮了火柴——\n\n火光起来的瞬间，雾里多了一个影子。\n\n那是父亲的轮廓。他站在旧码头方向的雾里，像在等谁。伊澄攥紧提灯，指节发白，却看见父亲的影子朝她转过头，嘴唇翕动，说出一句被雾气吞没的话。\n\n她没能听清。但她记住了那双眼睛——那不是告别，是警告。",
  "summary": "伊澄在父亲失踪后得到旧提灯，第一次点亮时在雾中看见父亲的亡影，影子的眼神像在警告什么。",
  "word_count": 280,
  "foreshadows": [
    { "item": "旧提灯", "hint": "能照见亡者记忆", "payoff_chapter": null },
    { "item": "父亲的眼睛", "hint": "雾中影子的警告眼神", "payoff_chapter": null }
  ]
}
